{
  "$schema": "https://json-schema.org/draft/2020-12/schema",
  "$id": "https://metadax.daxfoundation.org/schemas/0.3/node.schema.json",
  "title": "metadax.node/0.3-x02-proposed",
  "type": "object",
  "additionalProperties": false,
  "required": [
    "schema", "id", "parent_id", "kind", "depth", "anchor", "title",
    "question", "canonical_question", "intent", "summary", "concepts",
    "new_concepts", "bloom_level", "scope", "reuse", "links", "core",
    "seeds", "created_by", "visibility"
  ],
  "properties": {
    "schema": { "const": "metadax.node/0.3" },
    "id": { "$ref": "#/$defs/nodeId" },
    "parent_id": { "anyOf": [ { "$ref": "#/$defs/nodeId" }, { "type": "null" } ] },
    "slug": { "$ref": "#/$defs/slug" },
    "legacy_id": { "type": "string", "maxLength": 200 },
    "kind": { "enum": ["objective", "followup"] },
    "depth": { "type": "integer", "minimum": 1 },
    "anchor": { "anyOf": [ { "$ref": "#/$defs/anchor" }, { "type": "null" } ] },
    "title": { "type": "string", "maxLength": 80 },
    "question": { "type": "string", "maxLength": 500 },
    "canonical_question": { "type": "string" },
    "intent": { "anyOf": [ { "$ref": "#/$defs/intent" }, { "type": "null" } ] },
    "summary": { "type": "array", "items": { "type": "string" } },
    "concepts": { "type": "array", "items": { "$ref": "#/$defs/conceptId" } },
    "new_concepts": { "type": "array", "items": { "$ref": "#/$defs/newConcept" } },
    "bloom_level": { "$ref": "#/$defs/bloom" },
    "scope": { "enum": ["in_scope", "adjacent", "out_of_scope"] },
    "reuse": { "anyOf": [ { "$ref": "#/$defs/reuse" }, { "type": "null" } ] },
    "links": { "type": "array", "items": { "$ref": "#/$defs/link" } },
    "core": { "$ref": "#/$defs/core" },
    "seeds": { "type": "array", "items": { "type": "string" } },
    "path": { "type": "array", "items": { "$ref": "#/$defs/pathEntry" } },
    "created_by": { "$ref": "#/$defs/createdBy" },
    "visibility": { "enum": ["private", "pending_review", "accepted", "shared"] },
    "reviewed_by": { "type": "array", "items": { "$ref": "#/$defs/createdBy" } },
    "accepted_by": { "type": "array", "items": { "$ref": "#/$defs/createdBy" } },
    "contested": { "type": "boolean" },
    "contested_with": { "type": "array", "items": { "$ref": "#/$defs/nodeId" } },
    "contest_id": { "type": "string", "maxLength": 200 },
    "stuck_signature": { "type": "string", "maxLength": 200 },
    "created_at": { "$ref": "#/$defs/rfc3339" },
    "updated_at": { "$ref": "#/$defs/rfc3339" },
    "content_sha256": { "$ref": "#/$defs/hash" },
    "superseded_by": { "anyOf": [ { "$ref": "#/$defs/nodeId" }, { "type": "null" } ] },
    "alias_of": { "anyOf": [ { "$ref": "#/$defs/nodeId" }, { "type": "null" } ] },
    "model": { "type": "string" },
    "stats": { "$ref": "#/$defs/stats" }
  },
  "$defs": {
    "rfc3339": {
      "anyOf": [
        { "type": "string", "pattern": "^\\d{4}-\\d{2}-\\d{2}T\\d{2}:\\d{2}:\\d{2}(\\.\\d+)?(Z|[+-]\\d{2}:\\d{2})$" },
        { "const": "runtime" }
      ]
    },
    "hash": {
      "anyOf": [
        { "type": "string", "pattern": "^[0-9a-f]{64}$" },
        { "const": "runtime" }
      ]
    },
    "nodeId": { "type": "string", "pattern": "^(L\\d\\d\\.M\\d\\d\\.O\\d\\d|n_[0-9a-hjkmnp-tv-z]{26})$" },
    "slug": { "type": "string", "maxLength": 32, "pattern": "^[a-z0-9]+(-[a-z0-9]+)*$" },
    "conceptId": { "type": "string", "pattern": "^[a-z0-9]+(-[a-z0-9]+)*$" },
    "sectionId": { "type": "string", "pattern": "^s\\d+$" },
    "createdBy": { "type": "string", "maxLength": 200, "pattern": "^[A-Za-z0-9._-]+$" },
    "bloom": { "enum": ["Remember", "Understand", "Apply", "Analyze", "Evaluate", "Create"] },
    "intent": { "enum": ["clarify", "deepen", "example", "apply", "connect", "contrast", "challenge", "tangent"] },
    "anchor": {
      "type": "object",
      "additionalProperties": false,
      "required": ["section_id", "quote"],
      "properties": {
        "section_id": { "$ref": "#/$defs/sectionId" },
        "quote": { "type": "string", "maxLength": 200 }
      }
    },
    "newConcept": {
      "type": "object",
      "additionalProperties": false,
      "required": ["id", "name", "description"],
      "properties": {
        "id": { "$ref": "#/$defs/conceptId" },
        "name": { "type": "string" },
        "description": { "type": "string" }
      }
    },
    "reuse": {
      "type": "object",
      "additionalProperties": false,
      "required": ["decision", "of", "confidence", "rationale"],
      "properties": {
        "decision": { "enum": ["new", "extend"] },
        "of": { "anyOf": [ { "$ref": "#/$defs/nodeId" }, { "type": "null" } ] },
        "confidence": { "type": "number", "minimum": 0, "maximum": 1 },
        "rationale": { "type": "string" }
      }
    },
    "link": {
      "type": "object",
      "additionalProperties": false,
      "required": ["id", "relation"],
      "properties": {
        "id": { "$ref": "#/$defs/nodeId" },
        "relation": { "enum": ["extend", "reuse", "redirect"] }
      }
    },
    "section": {
      "type": "object",
      "additionalProperties": false,
      "required": ["id", "heading", "body_md"],
      "properties": {
        "id": { "$ref": "#/$defs/sectionId" },
        "heading": { "type": "string" },
        "body_md": { "type": "string" },
        "check": {
          "type": "object",
          "additionalProperties": false,
          "required": ["question", "answer"],
          "properties": {
            "question": { "type": "string" },
            "answer": { "type": "string" }
          }
        }
      }
    },
    "core": {
      "type": "object",
      "additionalProperties": false,
      "required": ["sections", "key_points", "bridge_to_parent", "bridge_to_objective", "source_refs"],
      "properties": {
        "sections": { "type": "array", "items": { "$ref": "#/$defs/section" } },
        "key_points": { "type": "array", "items": { "type": "string" } },
        "bridge_to_parent": { "type": "string" },
        "bridge_to_objective": { "type": "string" },
        "source_refs": { "type": "array", "items": { "type": "string" } }
      }
    },
    "pathEntry": {
      "anyOf": [
        {
          "type": "object",
          "additionalProperties": false,
          "required": ["id", "summary"],
          "properties": {
            "id": { "type": "string" },
            "title": { "type": "string" },
            "canonical_question": { "type": "string" },
            "summary": { "type": "string" }
          }
        },
        {
          "type": "object",
          "additionalProperties": false,
          "required": ["id", "summary", "covers_count", "first_covered", "last_covered"],
          "properties": {
            "id": { "const": "trail" },
            "summary": { "type": "string" },
            "covers_count": { "type": "integer", "minimum": 0 },
            "first_covered": { "type": "string" },
            "last_covered": { "type": "string" }
          }
        }
      ]
    },
    "stats": {
      "type": "object",
      "additionalProperties": false,
      "required": ["views", "reuse_count"],
      "properties": {
        "views": { "type": "integer", "minimum": 0 },
        "reuse_count": { "type": "integer", "minimum": 0 }
      }
    }
  }
}
