{
  "schema": "metadax.node/0.3",
  "id": "n_ka7589qwn4z1n2tghxxcv2vzbm",
  "slug": "cytochrome-c-structure-role",
  "legacy_id": "L01.M01.O01/proteins-essential-atp-synthesis/cytochrome-c-structure-role",
  "parent_id": "n_qkx5r9e0psvqpbd631wz7s98vm",
  "kind": "followup",
  "depth": 3,
  "anchor": {
    "section_id": "s2",
    "quote": "Four upstream complexes, numbered one through four, use energy from food-derived electrons to pump protons across the membrane"
  },
  "title": "Cytochrome c: structure and role",
  "question": "and what about cytochrome c?",
  "canonical_question": "What does cytochrome c do in the electron transport chain?",
  "intent": "deepen",
  "summary": [
    "Cytochrome c is a small mobile electron carrier.",
    "It shuttles electrons from Complex III to Complex IV."
  ],
  "concepts": [
    "cytochrome-c",
    "electron-transport-chain"
  ],
  "new_concepts": [],
  "bloom_level": "Understand",
  "scope": "in_scope",
  "reuse": {
    "decision": "new",
    "of": null,
    "confidence": 0,
    "rationale": "No existing node describes the mobile carrier between complexes."
  },
  "links": [],
  "core": {
    "sections": [
      {
        "id": "s1",
        "heading": "A small mobile carrier",
        "body_md": "Cytochrome c is a small protein that carries electrons. Unlike the large complexes fixed in the membrane, it is loosely attached to the membrane surface and can move along it. That mobility lets it act as a shuttle."
      },
      {
        "id": "s2",
        "heading": "What it connects",
        "body_md": "Cytochrome c picks up an electron from Complex III and drops it off at Complex IV. By ferrying electrons between these two fixed stations, it keeps the chain flowing without either complex having to touch the other."
      }
    ],
    "key_points": [
      "Cytochrome c is a small, mobile electron carrier.",
      "It shuttles electrons from Complex III to Complex IV."
    ],
    "bridge_to_parent": "It fills in one of the upstream carriers named among the essential proteins.",
    "bridge_to_objective": "",
    "source_refs": []
  },
  "seeds": [
    "How exactly does it hand electrons to Complex IV?",
    "What happens if cytochrome c leaks out of the mitochondrion?",
    "How is it different from the fixed complexes?"
  ],
  "path": [
    {
      "id": "L01.M01.O01",
      "title": "Introduction to energy production in the mitochondria",
      "summary": "Cellular respiration converts nutrients into ATP. Most ATP is made in the mitochondrion."
    },
    {
      "id": "n_qkx5r9e0psvqpbd631wz7s98vm",
      "title": "Proteins essential for ATP synthesis",
      "summary": "ATP synthase has a proton-driven rotor and a catalytic head. Complexes I to IV build the proton gradient that drives it."
    }
  ],
  "created_by": "lrn-fixture01",
  "visibility": "shared",
  "created_at": "2026-09-27T19:03:28Z",
  "updated_at": "2026-09-27T19:03:28Z",
  "content_sha256": "734ff93095aa61bd7df8b95682c9837328415ae402f1f8dcc00ca7910360fe26",
  "superseded_by": null,
  "model": "author-fixture",
  "stats": {
    "views": 0,
    "reuse_count": 0
  }
}
