{
  "schema": "metadax.node/0.3",
  "id": "n_g0m2j96105xvemv1dg91888cer",
  "slug": "solving-fma-for-a",
  "legacy_id": "L02.M01.O01/solving-fma-for-a",
  "parent_id": "L02.M01.O01",
  "kind": "followup",
  "depth": 2,
  "anchor": null,
  "title": "Solving F = ma for the acceleration",
  "question": "",
  "canonical_question": "How do you solve F = ma when you want the acceleration?",
  "intent": "apply",
  "summary": [
    "Start from F = ma and treat acceleration as the unknown.",
    "If the net force is fixed, a heavier object gets a smaller acceleration, which is why loaded trucks pick up speed slowly."
  ],
  "concepts": [
    "newtons-second-law"
  ],
  "new_concepts": [],
  "bloom_level": "Understand",
  "scope": "in_scope",
  "reuse": {
    "decision": "new",
    "of": null,
    "confidence": 0,
    "rationale": "Authored fixture node for the E05 registry."
  },
  "links": [],
  "core": {
    "sections": [
      {
        "id": "s1",
        "heading": "The algebra step",
        "body_md": "Start from F = ma and treat acceleration as the unknown. Dividing through by mass leaves a on its own: a equals F over m. It is one algebra step, but the physics is that mass resists the change the force is trying to make."
      },
      {
        "id": "s2",
        "heading": "Reading the result",
        "body_md": "If the net force is fixed, a heavier object gets a smaller acceleration, which is why loaded trucks pick up speed slowly. If the mass is fixed, more net force means proportionally more acceleration. The single ratio a = F / m captures both effects."
      }
    ],
    "key_points": [
      "Divide F = ma by mass to get a = F / m.",
      "Heavier objects accelerate less for the same force.",
      "The net force is what goes in the numerator."
    ],
    "bridge_to_parent": "It restates the objective’s law rearranged for acceleration.",
    "bridge_to_objective": "",
    "source_refs": []
  },
  "seeds": [
    "Where does friction enter this?",
    "How would I find the force instead?"
  ],
  "path": [
    {
      "id": "L02.M01.O01",
      "summary": "Parent objective node."
    }
  ],
  "created_by": "author-e05",
  "visibility": "shared",
  "superseded_by": null,
  "created_at": "2026-09-28T00:22:58Z",
  "updated_at": "2026-09-28T00:22:58Z",
  "content_sha256": "074b36a561c254309eeffd7236acdb05650ab4912c74a34e90782d8bcaad604a"
}
