{
  "schema": "metadax.node/0.3",
  "id": "n_v1yp8m4t981a6wrtn0632m7atm",
  "slug": "units-of-acceleration",
  "legacy_id": "L01.M01.O02/units-of-acceleration",
  "parent_id": "L01.M01.O02",
  "kind": "followup",
  "depth": 2,
  "anchor": null,
  "title": "The units of acceleration",
  "question": "",
  "canonical_question": "What units is acceleration measured in and why?",
  "intent": "clarify",
  "summary": [
    "Acceleration is how fast velocity changes each second, so its unit is metres per second, per second, written m/s^2.",
    "The seconds appear twice because we track a change in a per-second quantity over more seconds."
  ],
  "concepts": [
    "kinematic-quantities"
  ],
  "new_concepts": [],
  "bloom_level": "Understand",
  "scope": "in_scope",
  "reuse": {
    "decision": "new",
    "of": null,
    "confidence": 0,
    "rationale": "Authored fixture node for the E05 registry."
  },
  "links": [],
  "core": {
    "sections": [
      {
        "id": "s1",
        "heading": "Metres per second per second",
        "body_md": "Acceleration is how fast velocity changes each second, so its unit is metres per second, per second, written m/s^2. If a car gains 3 m/s of speed every second, its acceleration is 3 m/s^2. The doubled \"per second\" is the whole point."
      },
      {
        "id": "s2",
        "heading": "Making sense of the square",
        "body_md": "The seconds appear twice because we track a change in a per-second quantity over more seconds. It is not an area despite the squared look. Reading it aloud as \"metres per second, each second\" keeps the meaning clear."
      }
    ],
    "key_points": [
      "Acceleration is measured in m/s^2.",
      "It is a change of velocity per second.",
      "The squared second is not an area."
    ],
    "bridge_to_parent": "It clarifies the units behind the objective’s acceleration.",
    "bridge_to_objective": "",
    "source_refs": []
  },
  "seeds": [
    "How does this relate to g?",
    "What are the units of force then?"
  ],
  "path": [
    {
      "id": "L01.M01.O02",
      "summary": "Parent objective node."
    }
  ],
  "created_by": "author-e05",
  "visibility": "shared",
  "superseded_by": null,
  "created_at": "2026-09-28T00:22:59Z",
  "updated_at": "2026-09-28T00:22:59Z",
  "content_sha256": "e1cfeecfd40d22f76874550bcb7ca4b35c4644bb291be0de49196fc7b328e63d"
}
