{
  "schema": "metadax.node/0.3",
  "id": "n_qvvh0egfnr4pv3bqqf94trcmh0",
  "slug": "fictitious-forces-in",
  "legacy_id": "L01.M02.O02/fictitious-forces-in-accelerating-frames",
  "parent_id": "L01.M02.O02",
  "kind": "followup",
  "depth": 2,
  "anchor": null,
  "title": "Fictitious forces in accelerating frames",
  "question": "",
  "canonical_question": "What fictitious forces appear in a non-inertial (accelerating) reference frame?",
  "intent": "deepen",
  "summary": [
    "In an accelerating frame, objects seem to be pushed by forces that have no physical source.",
    "Pressed back into your seat as a car accelerates, or flung outward on a roundabout, you feel such apparent forces."
  ],
  "concepts": [
    "inertial-frame"
  ],
  "new_concepts": [],
  "bloom_level": "Understand",
  "scope": "in_scope",
  "reuse": {
    "decision": "new",
    "of": null,
    "confidence": 0,
    "rationale": "Authored fixture node for the E05 registry."
  },
  "links": [],
  "core": {
    "sections": [
      {
        "id": "s1",
        "heading": "Forces that come from the frame",
        "body_md": "In an accelerating frame, objects seem to be pushed by forces that have no physical source. These are called fictitious or inertial forces, and they appear only because the frame itself is accelerating. In an inertial frame they vanish."
      },
      {
        "id": "s2",
        "heading": "Familiar examples",
        "body_md": "Pressed back into your seat as a car accelerates, or flung outward on a roundabout, you feel such apparent forces. Really you are just resisting the frame’s acceleration through your own inertia. Naming them helps calculation but they are not true interactions."
      }
    ],
    "key_points": [
      "Non-inertial frames introduce fictitious forces.",
      "They have no physical source body.",
      "They disappear in an inertial frame."
    ],
    "bridge_to_parent": "It deepens the objective by contrasting inertial and non-inertial frames.",
    "bridge_to_objective": "",
    "source_refs": []
  },
  "seeds": [
    "Is centrifugal force real?",
    "How do I switch back to an inertial frame?"
  ],
  "path": [
    {
      "id": "L01.M02.O02",
      "summary": "Parent objective node."
    }
  ],
  "created_by": "author-e05",
  "visibility": "shared",
  "superseded_by": null,
  "created_at": "2026-09-28T00:22:59Z",
  "updated_at": "2026-09-28T00:22:59Z",
  "content_sha256": "7184c4c1c842abddba0bac440970e7a851ed9692b90017f5c8651f215f84316c"
}
