{
  "schema": "metadax.node/0.3",
  "id": "n_q36rxbw22q0z9gwrcpy4yf4w28",
  "slug": "instantaneous-vs-average",
  "legacy_id": "L01.M01.O02/instantaneous-vs-average-velocity",
  "parent_id": "L01.M01.O02",
  "kind": "followup",
  "depth": 2,
  "anchor": null,
  "title": "Instantaneous versus average velocity",
  "question": "",
  "canonical_question": "What is the difference between instantaneous and average velocity?",
  "intent": "contrast",
  "summary": [
    "Average velocity is the total displacement divided by the total time for a trip.",
    "The two are equal only when the velocity is constant throughout."
  ],
  "concepts": [
    "kinematic-quantities"
  ],
  "new_concepts": [],
  "bloom_level": "Understand",
  "scope": "in_scope",
  "reuse": {
    "decision": "new",
    "of": null,
    "confidence": 0,
    "rationale": "Authored fixture node for the E05 registry."
  },
  "links": [],
  "core": {
    "sections": [
      {
        "id": "s1",
        "heading": "Now versus over a stretch",
        "body_md": "Average velocity is the total displacement divided by the total time for a trip. Instantaneous velocity is the velocity at a single moment, what the speedometer shows. A journey can have a modest average yet high instantaneous values along the way."
      },
      {
        "id": "s2",
        "heading": "When they agree",
        "body_md": "The two are equal only when the velocity is constant throughout. Whenever speed or direction changes, the instantaneous value drifts above or below the average. Distinguishing them avoids mistakes in motion problems."
      }
    ],
    "key_points": [
      "Average velocity is displacement over total time.",
      "Instantaneous velocity is the value at one instant.",
      "They match only for constant velocity."
    ],
    "bridge_to_parent": "It contrasts two velocity measures under the objective.",
    "bridge_to_objective": "",
    "source_refs": []
  },
  "seeds": [
    "How do I compute an average over several legs?",
    "Which does a speedometer show?"
  ],
  "path": [
    {
      "id": "L01.M01.O02",
      "summary": "Parent objective node."
    }
  ],
  "created_by": "author-e05",
  "visibility": "shared",
  "superseded_by": null,
  "created_at": "2026-09-28T00:22:59Z",
  "updated_at": "2026-09-28T00:22:59Z",
  "content_sha256": "46e49baf26efa818b5526c61a41fcb1e32cde2bccc9ce753da805678dc687147"
}
